Exploring Feature Normalization and Temporal Information for Machine Learning Based Insider Threat Detection,P. Ferreira; D. C. Le; N. Zincir-Heywood,"Faculty of Computer Science, Dalhousie University, Halifax, Nova Scotia, Canada; Faculty of Computer Science, Dalhousie University, Halifax, Nova Scotia, Canada; Faculty of Computer Science, Dalhousie University, Halifax, Nova Scotia, Canada",2019 15th International Conference on Network and Service Management (CNSM),27-Feb-20,2019,,,1,7,"Insider threat is one of the most damaging cyber security attacks to companies and organizations. In this paper, we explore different techniques to leverage spatial and temporal characteristics of user behaviours for insider threat detection. In particular, feature normalization (scaling) techniques and a scheme for representing explicit temporal information are explored to improve the performance of the machine learning based insider threat detection. The results show that these data characteristics have different effects on different classifiers, where Standard Scaler with Random Forest classifier produces the best performance.",2165-963X,978-3-903176-24-9,10.23919/CNSM46954.2019.9012708,,https://ieeexplore.ieee.org/stamp/stamp.jsp?arnumber=9012708,Insider Threat Detection;Machine Learning;Spatial and Temporal Data Characteristics,Standards;Transforms;Machine learning;Organizations;Logistics;Distribution functions;Feature extraction,,52,,40,,27-Feb-20,21-25 Oct. 2019,21-25 Oct. 2019,IEEE,IEEE Conferences
Enhancing Behavioral Insider Threat Detection with AI,R. S. Bakhit; A. Abo-alian; N. L. Badr,"Information Systems Dept, Faculty of Computer and Information Sciences, Ain Shams University, Cairo, Egypt; Information Systems Dept, Faculty of Computer and Information Sciences, Ain Shams University, Cairo, Egypt; Information Systems Dept, Faculty of Computer and Information Sciences, Ain Shams University, Cairo, Egypt",2025 Twelfth International Conference on Intelligent Computing and Information Systems (ICICIS),31-Dec-25,2025,,,381,388,"Malicious insider threats pose a significant challenge to the security of organizational and governmental systems due to the legitimate access insiders possess. This research presents a comprehensive detection framework that combines machine learning and deep learning models to identify abnormal user behavior. The system addresses key challenges such as limited labeled data and evolving attack patterns by utilizing multi-level feature engineering and temporal analysis of user activities under realistic conditions. Evaluated using the CERT v4.2 email dataset, the framework achieved a detection accuracy of up to 99.08% with the GRU model. Additionally, it demonstrated efficient runtime performance, with the Multi-Layer Perceptron model completing the testing phase in just 0.21 seconds. These findings highlight the system's effectiveness in distinguishing between normal and anomalous behaviors while maintaining low computational overhead, making it well-suited for real-world security applications.",2831-5952,979-8-3315-2498-2,10.1109/ICICIS66182.2025.11313138,,https://ieeexplore.ieee.org/stamp/stamp.jsp?arnumber=11313138,Cyberattacks;Insider Threats;Machine Learning;Deep Learning;User Behavior Analytics;Threat Hunting,Deep learning;Runtime;Accuracy;Computational modeling;Threat assessment;Security;Computer crime;Testing;Information systems,,,,27,IEEE,31-Dec-25,25-27 Nov. 2025,25-27 Nov. 2025,IEEE,IEEE Conferences
Enhancing Security Service of Data Protection Level using Machine Learning,P. Velmurugadass; S. Dhanasekaran,"Department of Computer Science and Engineering, Kalasalingam Academy of Research and Education, Krishnankoil, Tamil Nadu, India; Department of Computer Science and Engineering, Kalasalingam Academy of Research and Education, Krishnankoil, Tamil Nadu, India",2021 2nd Global Conference for Advancement in Technology (GCAT),9-Nov-21,2021,,,1,5,"Insider threats become more dangerous and introduce high risk in the organization. In general, insider attackers seek to theft or alter the organization data with intentions. As insider threats are more difficult to detect, still major issues are there. In this research, the machine learning (ML) approach is proposed to analyze and detect insider threats. This project focuses on detecting insiders by learning the behaviour of insider threats continuously. At first, the insider dataset is collected and pre-processed. The preprocessing step breaks the data into a granular level (i.e.) weekly, daily and hourly behaviour data. Then, this data is processed with feature extraction in which the required features including HTTP features, E-mail features, file features, and USB features are extracted from each data instance. These are the main feature categories and each category consists of several features that are useful in insider detection. Then, the features are fed into the Random Forest (RF) classifier, one of the best ML algorithms. Finally, the RF classifies data into insiders and normally based on the features. The experimental analysis shows that the proposed ML-based insider threat detection model in granular level works is more accurate.",,978-1-6654-1836-2,10.1109/GCAT52182.2021.9587730,,https://ieeexplore.ieee.org/stamp/stamp.jsp?arnumber=9587730,Machine Learning;Random Forest;Cloud Computing;Cyber Security,Radio frequency;Time-frequency analysis;Machine learning algorithms;Organizations;Forestry;Feature extraction;Universal Serial Bus,,1,,15,IEEE,9-Nov-21,1-3 Oct. 2021,1-3 Oct. 2021,IEEE,IEEE Conferences
A High Accuracy and Adaptive Anomaly Detection Model With Dual-Domain Graph Convolutional Network for Insider Threat Detection,X. Li; X. Li; J. Jia; L. Li; J. Yuan; Y. Gao; S. Yu,"Key Laboratory of Trustworthy Distributed Computing and Service, Ministry of Education, Beijing University of Posts and Telecommunications, Beijing, China; Key Laboratory of Trustworthy Distributed Computing and Service, Ministry of Education, Beijing University of Posts and Telecommunications, Beijing, China; Key Laboratory of Trustworthy Distributed Computing and Service, Ministry of Education, Beijing University of Posts and Telecommunications, Beijing, China; Key Laboratory of Trustworthy Distributed Computing and Service, Ministry of Education, Beijing University of Posts and Telecommunications, Beijing, China; Key Laboratory of Trustworthy Distributed Computing and Service, Ministry of Education, Beijing University of Posts and Telecommunications, Beijing, China; Key Laboratory of Trustworthy Distributed Computing and Service, Ministry of Education, Beijing University of Posts and Telecommunications, Beijing, China; School of Computer Science, University of Technology Sydney, Ultimo, NSW, Australia",IEEE Transactions on Information Forensics and Security,1-Mar-23,2023,18,,1638,1652,"Insider threat is destructive and concealable, making addressing it a challenging task in cybersecurity. Most existing methods transform user behavior into sequential information and analyze user behavior while neglecting structural information among users, resulting in high false positives. To solve this problem, in this paper, we propose Dual-Domain Graph Convolutional Network (referred to as DD-GCN), a graph-based modularized method for high accuracy and adaptive insider threat detection. The central idea is to convert user features and structural information into heterogeneous graphs in the light of various relationships and take user behavior and relationship into account together. To this end, a weighted feature similarity mechanism is applied to balance the feature similarity of users and original linkages among them so as to generate the fused structure. Next, specific graph embeddings are extracted from the original topology structure and fused structure simultaneously, which convert behavior information into high-level representations. Furthermore, an attention mechanism is applied to learn the adaptive importance weights of the user’s features in the corresponding embedding. The combination and difference constraints are proposed to enhance the learned embeddings’ commonality and the ability to capture different information. Extensive experiments on two real-world datasets clearly show that our proposed DD-GCN extracts the most correlated information from structural topology and feature information substantially, and achieves improved accuracy with a clear margin.",1556-6021,,10.1109/TIFS.2023.3245413,"National Natural Science Foundation of China(grant numbers:62202066,62102040,62002028); ",https://ieeexplore.ieee.org/stamp/stamp.jsp?arnumber=10044727,Insider threat detection;anomaly detection;graph convolutional network,Behavioral sciences;Feature extraction;Convolutional neural networks;Topology;Adaptation models;Network topology;Couplings,,43,,44,IEEE,14-Feb-23,2023,,IEEE,IEEE Journals
GraphLLM-CPS: LLM Node Embeddings for Anomaly Detection in Cyber-Physical Systems,G. Fragkos; S. Wright; C. B. Jones,"Sandia National Laboratories, Albuquerque, NM, USA; Sandia National Laboratories, Albuquerque, NM, USA; Sandia National Laboratories, Albuquerque, NM, USA",2025 IEEE 30th International Workshop on Computer Aided Modeling and Design of Communication Links and Networks (CAMAD),13-Nov-25,2025,,,1,7,"Cyber-physical systems (CPS) are increasingly integral to the operation of critical infrastructure, blending physical processes with computational intelligence to enable advanced functionality. However, the interconnected nature of CPS makes them vulnerable to sophisticated cyber threats and physical anomalies, necessitating robust anomaly detection mechanisms. In this paper, we explore the IEEE 123 bus system to detect a stealthy insider threat resulting to a volt-var attack targeting photovoltaic (PV) systems, where the volt-var control is disabled to disrupt grid voltage operations. We propose GraphLLM-CPS, a novel framework leveraging Large Language Models (LLMs) to generate node embeddings for anomaly detection in CPS. By converting graph-based representations of CPS data into textual formats, LLMs are employed to extract meaningful node embeddings that capture the structural and semantic relationships within the system. These embeddings are then utilized to train supervised and unsupervised classifiers for detecting and locating anomalous nodes and events. The proposed approach is evaluated on CPS datasets derived from the IEEE 123 bus system, demonstrating its effectiveness in locating anomalies with high accuracy. Furthermore, we visualize the detected anomalies and compare them with ground truth impacted nodes, providing insights into the system’s behavior during the stealthy volt-var attack. The results highlight the potential of LLM-driven embeddings to enhance the security and resilience of cyber-physical systems against emerging threats.",2378-4873,979-8-3315-6534-3,10.1109/CAMAD67323.2025.11229892,,https://ieeexplore.ieee.org/stamp/stamp.jsp?arnumber=11229892,LLM;Generative AI;embeddings;cyber-physical security;anomaly detection,Photovoltaic systems;Electric potential;Generative AI;Large language models;Semantics;Cyber-physical systems;Critical infrastructure;Voltage control;Anomaly detection;Resilience,,1,,18,IEEE,13-Nov-25,14-16 Oct. 2025,14-16 Oct. 2025,IEEE,IEEE Conferences
Deep Learning-Enhanced Multi-Modal Fusion for Anomaly-based Insider Threat Detection in Enterprise Environments,S. Kodumuri; R. Dadi,"School of Computer Science and Artificaial Intelligence, SR University, Warangal, Telangana, India; School of Computer Science and Artificaial Intelligence, SR University, Warangal, Telangana, India",2025 International Conference on NexGen Networks and Cybernetics (IC2NC),17-Feb-26,2025,,,188,194,"Insider threats are creating more cyber security challenges, with the unauthorized access and knowledge of organizational security measures. This research presents a novel multi-modal hybrid ensemble method, by integrating behavioral analytics, BERT-based semantic embeddings, and psychometric profiling for insider threat detection. The model extracts 30+ behavioral features from authentication logs, device interactions, email communications, and file operations, while generating deep semantic representations using BERT transformers, and the big dimensions are reduced with PCA. The labels are generated with an intelligent labeling mechanism based on z-score normalization and multi-criteria thresholding. The weighted ensemble architecture combines Random Forest, XGBoost, LightGBM, and Gradient Boosting classifiers with performance-adaptive weighting. The model is evaluated on the CERT R4.2 dataset, and the framework achieves exceptional performance: 99.25% accuracy, 99.23% weighted F1-score and AUC scores in between 0.995-1.000. The performance of the model illustrates that psychometric risk profiling significantly enhances detection capabilities, with the composite risk score emerging as the most discriminative feature, validating this interdisciplinary approach for operational enterprise security deployment.",,979-8-3315-9484-8,10.1109/IC2NC67409.2025.11376104,,https://ieeexplore.ieee.org/stamp/stamp.jsp?arnumber=11376104,Insider threat detection;Deep learning;fusion model;ensemble model,Accuracy;Soft sensors;Semantics;Semisupervised learning;Feature extraction;Transformers;Threat assessment;Security;Labeling;Random forests,,,,19,IEEE,17-Feb-26,1-3 Dec. 2025,1-3 Dec. 2025,IEEE,IEEE Conferences
Towards an Explainable Approach for Insider Threat Detection: Constraint Network Learning,R. Orizio; S. Vuppala; S. Basagiannis; G. Provan,"School of Computer Science, University College Cork, Cork, Ireland; United Technologies Research Center, Penrose Wharf, Cork, Ireland; United Technologies Research Center, Penrose Wharf, Cork, Ireland; School of Computer Science, University College Cork, Cork, Ireland",2020 International Conference on Intelligent Data Science Technologies and Applications (IDSTA),30-Nov-20,2020,,,42,49,"Insider threats are considered a major threat to information and communication technology (ICT) systems creating an important source of vulnerabilities from a security perspective. The technical knowledge that insiders have about the ICT systems, such as its IT infrastructure, the high load of data generated by other employees of the company which hides insiders' activities, their access rights as well as the confidentiality of the data of which they have access to, creates the perfect scenario for a powerful yet undetected attack. State of the art techniques and security operations center tools struggle to come up with effective solutions to recognise these threats. Therefore, in this paper, we propose a novel artificial intelligence based constraint learning technique to help their detection. The approach creates an optimized constraint network representing the nominal behaviour of an employee and detects threatening events when their associated costs are above a certain threshold. The threshold is learnt alongside with the constraint network model. The proposed approach is based on detection models able to provide human interpretable feedback regarding the detection performed. These information are crucial in helping system operators to understand why the detection has occurred and to help them acting promptly on the threat. The explanation comes directly from the structure of the detection model and relies on the identification of which constraints are being violated. The approach is tested on the CERT insider threat dataset v4.2 and the results obtained look promising, achieving at least the same accuracy as other state of the art techniques as well as providing the details regarding the broken constraints of the threat. A comparison with state of the art techniques applied on this dataset is also provided, showing the strength of our results.",,978-1-7281-8376-3,10.1109/IDSTA50958.2020.9264049,European Union's Horizon 2020 research and innovation programme InfraStress(grant numbers:833088); ,https://ieeexplore.ieee.org/stamp/stamp.jsp?arnumber=9264049,Anomaly detection;Insider threat;Constraint Programming;Machine Learning;Constraint Learning;Security Operations Center,Feature extraction;Security;Tools;Data mining;Training;Universal Serial Bus;Deep learning,,10,,19,IEEE,30-Nov-20,19-22 Oct. 2020,19-22 Oct. 2020,IEEE,IEEE Conferences
Insider Threat Detection using Explainable Machine Learning Models in Corporate Networks,P. Bhatnagar; S. K. Mandru; P. Sharma; V. Singh; J. P. Singh; S. Katheria,"ByteBrain, Sheridan, USA; Cisco Systems Inc, Atlanta, Georgia, USA; ByteBrain, Sheridan, USA; Palnar, New Jersey, USA; Head Product Security Risk and Compliance, Austin, Texas; Cloud Security Operations Informatica, Saratoga Springs, Utah, USA","2025 9th International Conference on Electronics, Communication and Aerospace Technology (ICECA)",13-Feb-26,2025,,,2033,2038,"Insider threats are a significant risk to corporate cybersecurity, as they can typically remain undetected using standard detection methods since they have legitimate access. The challenge is achieving high detection accuracy while also providing interpretability, since most state-of-the-art models are black-box machines. In this paper, we present an explainable insider threat detection model based on Gradient Boosted Decision Trees (GBDT), Explainable Boosting Machine (EBM), and Graph Neural Networks with attention mechanism. To improve transparency, we applied SHAP and LIME to both global and local explanations of anomalous activities. Using the CERT Insider Threat Dataset, the proposed system was able to achieve an accuracy of 96.3 percent, significantly higher than the five baseline methods used for comparison. Results show that it has a more reliable trustworthiness and fewer false positives for the analysts. The study highlights that explainable AI can not only increase reliability of threat detection, but also provide actionable information to decision-makers, bridging the gap between predictiveness and interpretability.",,979-8-3315-9929-4,10.1109/ICECA66444.2025.11383006,,https://ieeexplore.ieee.org/stamp/stamp.jsp?arnumber=11383006,Insider Threat Detection;Explainable AI;SHAP;LIME;GBDT;EBM;Graph Neural Networks;Cybersecurity,Analytical models;Adaptation models;Accuracy;Explainable AI;Boosting;Threat assessment;Graph neural networks;Reliability;Decision trees;Computer security,,,,20,IEEE,13-Feb-26,5-7 Nov. 2025,5-7 Nov. 2025,IEEE,IEEE Conferences
Anomaly Detection for Insider Threats Using Unsupervised Ensembles,D. C. Le; N. Zincir-Heywood,"Faculty of Computer Science, Dalhousie University, Halifax, NS, Canada; Faculty of Computer Science, Dalhousie University, Halifax, NS, Canada",IEEE Transactions on Network and Service Management,10-Jun-21,2021,18,2,1152,1164,"Insider threat represents a major cybersecurity challenge to companies, organizations, and government agencies. Insider threat detection involves many challenges, including unbalanced data, limited ground truth, and possible user behavior changes. This research presents an unsupervised learning based anomaly detection approach for insider threat detection. We employ four unsupervised learning methods with different working principles, and explore various representations of data with temporal information. Furthermore, different computational intelligence schemes are explored to combine these models to create anomaly detection ensembles for improving the detection performance. Evaluation results show that the approach allows learning from unlabelled data under challenging conditions for insider threat detection. Insider threats are detected with high detection and low false positive rates. For example, 60% of malicious insiders are detected under 0.1% investigation budget, and all malicious insiders are detected at less than 5% investigation budget. Furthermore, we explore the ability of the proposed approach to generalize for detecting new anomalous behaviors in different datasets, i.e., robustness. Finally, results demonstrate that a voting-based ensemble of anomaly detection can be used to improve detection performance as well as the robustness. Comparisons with the state-of-the-art confirm the effectiveness of the proposed approach.",1932-4537,,10.1109/TNSM.2021.3071928,Natural Science and Engineering Research Council of Canada (NSERC) and Compute Canada; Killam Trusts and the province of Nova Scotia; ,https://ieeexplore.ieee.org/stamp/stamp.jsp?arnumber=9399116,Insider threat detection;anomaly detection;ensemble learning;unsupervised learning;temporal data;dependable and robust learning,Anomaly detection;Organizations;Feature extraction;Hidden Markov models;Unsupervised learning;Training;Data models,,114,,57,IEEE,8-Apr-21,Jun-21,,IEEE,IEEE Journals
A General and Expandable Insider Threat Detection System Using Baseline Anomaly Detection and Scenario-Driven Alarm Filters,G. Yang; L. Cai; A. Yu; D. Meng,"Institute of Information Engineering Chinese Academy of Sciences, Beijing, Beijing, CN; Institute of Information Engineering Chinese Academy of Sciences, Beijing, Beijing, CN; Institute of Information Engineering Chinese Academy of Sciences, Beijing, Beijing, CN; Institute of Information Engineering Chinese Academy of Sciences, Beijing, Beijing, CN","2018 17th IEEE International Conference On Trust, Security And Privacy In Computing And Communications/ 12th IEEE International Conference On Big Data Science And Engineering (TrustCom/BigDataSE)",6-Sep-18,2018,,,763,773,"The insider threat continues to be a paramount cyber security challenge that threatens individuals, financial enterprises and governmental organizations. To deter insider threats, the scenario-driven detection approach has been a hot topic. However, the technological limitations in practice severely constrain the scenario-driven detection effect in reality. Therefore we propose a new general and expandable insider threat detection system that divides the detection into two functional modules: the baseline anomaly detection module, which are competent with multiple attack-scenario detections based on multi-domain behavioral mode features with adaptive characteristics, and the scenario-driven alarm filter module based on time-based anomaly frequency degree(TAFD) and attack beginning analysis. The multi-domain behavioral mode features enable us to effectively identify the user's abnormal behavior in general feature extraction and classification organization without a specific scenario analysis, whereas the exemplary scenario-driven alarm filter based on the time-based anomaly frequency degree is used to distinguish benign anomaly and attack anomaly according to the frequency characteristics from the scenario analysis, besides a specific alarm filter based on attack beginning analysis. The experimental results illustrate the effectiveness and feasibility of the proposed general and expandable insider threat detection system, by showing satisfactory true positive rate(TPR) and low false positive rate(FPR) with reasonable hit and tradeoff rate for multiple attack scenarios. This work lays the foundation for a promising insider threat detection architecture that integrates multiple scenario-driven detections into a normative, flexible and effective modular system.",2324-9013,978-1-5386-4388-4,10.1109/TrustCom/BigDataSE.2018.00110,,https://ieeexplore.ieee.org/stamp/stamp.jsp?arnumber=8455978,"baseline anomaly detection, insider threats, false alarm reduction, scenario-driven, behavioral mode, anomaly relevance",Feature extraction;Anomaly detection;Machine learning;Organizations;Time-frequency analysis;Biological system modeling;Analytical models,,9,,,IEEE,6-Sep-18,1-3 Aug. 2018,1-3 Aug. 2018,IEEE,IEEE Conferences
Research on Insider Threat Detection Methods Based on Convolutional Neural Networks,J. Peng; Z. Chen; S. Jiang,"Institute of Seismology, CEA, Wuhan, China; Institute of Seismology, CEA, Wuhan, China; China National Tobacco Corporation, Wuhan, China","2025 IEEE 4th International Conference on Computing, Communication, Perception and Quantum Technology (CCPQT)",17-Feb-26,2025,,,1,5,"Insider threat has become a significant challenge in the field of network security due to its dual characteristics of strong concealment and high destructiveness. If such threats are not detected, they can have disastrous consequences for enterprises or organizations, including key data leakage, disruption of business continuity, and reputation damage. Traditional insider threat detection methods often rely on static threshold strategies or shallow machine learning models, which suffer from the drawback of insufficient detection accuracy. This paper proposes a deep convolutional neural network detection framework. Firstly, a feature selection mechanism is constructed based on random forests, and redundant dimensions with less influence are eliminated using a voting mechanism. Then, a deep neural network is employed to extract local-dependent features of behavior sequences. Finally, key information about insider threats is effectively captured, and the detection results are obtained. Experiments on the public dataset of the CMU CERT R6.2 Research Center show that the accuracy of this method reaches 95.8%, which higher than traditional statistical machine learning methods such as Support Vector Machine and Random Forest, validating the effectiveness of the method.",,979-8-3315-2583-5,10.1109/CCPQT66408.2025.11383425,National Natural Science Foundation of China; ,https://ieeexplore.ieee.org/stamp/stamp.jsp?arnumber=11383425,Cyber Security;Insider Threat Detection;Machine learning;Deep learning,Support vector machines;Accuracy;Quantum computing;Scalability;Organizations;Feature extraction;Threat assessment;Robustness;Convolutional neural networks;Random forests,,,,10,IEEE,17-Feb-26,24-26 Oct. 2025,24-26 Oct. 2025,IEEE,IEEE Conferences
