SENTINEL: Insider Threat Detection Based on Multi-Timescale User Behavior Interaction Graph Learning,F. Xiao; S. Chen; S. Chen; Y. Ma; H. He; J. Yang,"Department of Automation, University of Science and Technology of China, Hefei, China; Department of Automation, University of Science and Technology of China, Hefei, China; Department of Automation, University of Science and Technology of China, Hefei, China; Department of Automation, University of Science and Technology of China, Hefei, China; Department of Automation, University of Science and Technology of China, Hefei, China; Department of Automation, University of Science and Technology of China, Hefei, China",IEEE Transactions on Network Science and Engineering,21-Feb-25,2025,12,2,774,790,"Insider threats have become a prominent driver behind a myriad of cybersecurity incidents in recent years. Since the threats take place within intranet, traditional security devices located at the network perimeter can hardly detect them. The trust management methods employed within the organization are likewise incapable of intercepting access actions already authenticated with valid credentials. In this paper, we propose a novel insider threat detection method named SENTINEL, which identifies abnormal behavior of insiders and provides fine-grained threat intelligence. We devise a dynamic user behavior interaction graph (BIG), which jointly considers the spatial distribution of user behavioral trajectories among the network topology and the temporal variations of user behavioral profiles. By incorporating a spatio-temporal graph neural network, SENTINEL is able to learn the operation regularities of users at specific times and respective positions in BIG. In order to perceive both the abrupt and persistent threats simultaneously, we conceive a multi-timescale fusion mechanism for detecting users' activities at different timescales. SENTINEL implements a log-entry-level detection without requiring any attack samples during model training. The experiments conducted on widely-used public datasets demonstrate that SENTINEL achieves superior performance while maintaining a relatively low computational overhead compared to the state-of-the-art methods.",2327-4697,,10.1109/TNSE.2024.3519155,"National Natural Science Foundation of China(grant numbers:U23A20275,62101525); China Environment for Network Innovations(grant numbers:2016-000052-73-01-000515); ",https://ieeexplore.ieee.org/stamp/stamp.jsp?arnumber=10804674,Insider threat detection;graph neural network;anomaly detection;behavior interaction graph (BIG),Threat assessment;Feature extraction;Graph neural networks;Security;Organizations;Image edge detection;Network topology;Machine learning algorithms;Hidden Markov models;Anomaly detection,,9,,46,IEEE,17-Dec-24,March-April 2025,,IEEE,IEEE Journals
Performance Evaluation of LSTM Autoencoder for Behavioral-Based Insider Threat Detection,S. Iseed; M. M. N. Hamarsheh,"Department of Cybersecurity, Arab American University, Ramallah, Palestine; Department of computer networks and security, Arab American University, Jenin, Palestine","2025 International Conference on Smart Applications, Communications and Networking (SmartNets)",15-Aug-25,2025,,,1,6,"Trusted employees in the companies may pose a serious threat to their organizations. Their malicious behaviors will be hard to detect because they depend on the complexity of human behavior, which poses a big challenge to companies, this is called an insider threat attack. Detecting insider actors requires sophisticated user behavior detection models. However, these models need to be highly resource efficient. The proposed approach focuses on insider threat detection using user behavior analysis deep learning. CMU-CERT insider threat $\mathbf{r 4. 2}$ dataset is used in our approach. The events were analyzed to extract the features; they were selected based on the valuable data they included, such as user identity, login and logoff time, etc. Feature vectors were created from selected features and split into training and testing data for the Long-Term-Short-Memory (LSTM) Autoencoder model and evaluated the resource usage during the training and testing stages. The results of the proposed solutions produced an Accuracy of 98.6%. Moreover, the average utilization of the Central Processing Unit (CPU) during training phase is only 6% and the usage of Random Access Memory (RAM) is stabilized at $\mathbf{2 5 0 MB}$.",2837-4940,979-8-3315-1196-8,10.1109/SmartNets65254.2025.11106886,,https://ieeexplore.ieee.org/stamp/stamp.jsp?arnumber=11106886,Insider Threat;LSTM Autoencoder;BehavioralBased threat detection;machine learning;cybersecurity,Training;Autoencoders;Random access memory;Companies;Feature extraction;Threat assessment;Central Processing Unit;Behavioral sciences;Long short term memory;Testing,,,,31,IEEE,15-Aug-25,22-24 July 2025,22-24 July 2025,IEEE,IEEE Conferences
Attention to Patterns is all you need for Insider threat detection,P. Tiwary; A. Madhubalan; A. Gautam; R. Darji,"Cortex Lab, Abluva, Pune, India; Cortex Lab, Abluva, Pune, India; Cortex Lab, Abluva, Pune, India; Cortex Lab, Abluva, Pune, India","2024 International Conference on Artificial Intelligence, Metaverse and Cybersecurity (ICAMAC)",9-Jan-25,2024,,,1,6,"Insider threats pose a significant and often underestimated risk to organizations. Traditional anomaly detection methods relying on simplistic patterns and lacking temporal awareness struggle to capture the nuances of user behavior, leading to missed detections and false alarms. This research proposes a novel approach that leverages the power of deep learning models to capture complex, hierarchical patterns in user behavior, enabling the early detection of malicious insider activity. The proposed approach introduces two distinct architectures: Time-Distributed Deep Learning Architecture (TD-CNN-LSTM) and Contextually Aware Attention-Based Architecture (TD-CNN-Attention). These architectures combine CNNs with LSTMs or attention mechanisms to extract both spatial and temporal features from user access data, capturing intricate patterns across different timescales. Additionally, they incorporate user information such as psychometrics and organizational data, providing a holistic view of user behavior and context. Through extensive evaluation, both architectures demonstrate significant improvements in accuracy and F1 score compared to existing insider threat detection solutions. The attention-based model in particular emerges as a state-of-the-art approach with superior performance capabilities. This research marks a significant step forward in the field of insider threat detection, paving the way for organizations to better secure their critical assets and safeguard their future in the ever-changing cybersecurity landscape.",,979-8-3503-5348-8,10.1109/ICAMAC62387.2024.10828982,,https://ieeexplore.ieee.org/stamp/stamp.jsp?arnumber=10828982,,Accuracy;Metaverse;Organizations;Feature extraction;Threat assessment;Stability analysis;HTTP;Fraud;Computer security;Thermal stability,,1,,30,IEEE,9-Jan-25,25-26 Oct. 2024,25-26 Oct. 2024,IEEE,IEEE Conferences
Contrastive Learning with Knowledge-Enhanced Prompts for Insider Threat Detection,H. Yu; Y. Guo; J. Wang; M. Zhu; Y. Xu; Z. Li,"Institute of Information Engineering, Chinese Academy of Sciences, Beijing, China; Institute of Information Engineering, Chinese Academy of Sciences, Beijing, China; Institute of Information Engineering, Chinese Academy of Sciences, Beijing, China; Institute of Information Engineering, Chinese Academy of Sciences, Beijing, China; Institute of Information Engineering, Chinese Academy of Sciences, Beijing, China; Institute of Information Engineering, Chinese Academy of Sciences, Beijing, China",2025 International Joint Conference on Neural Networks (IJCNN),14-Nov-25,2025,,,1,8,"Insider threat detection is essential for protecting organizations from malicious or negligent insiders. This paper proposes a knowledge-enhanced self-contrastive learning framework for insider threat detection in multi-source user behavior graph scenarios. In the user behavior graph representation phase, a multi-head attention mechanism with relational encoding is used to explore user adjacency relations, with node connectivity guiding subgraph sampling. In the knowledge enhancement phase, self-contrastive learning aligns subgraph embeddings with behavior descriptions generated by a prompt template, enriching user behavior features. Finally, the dual-stage detection scheme filters anomalous users using a variational autoencoder and categorizes them through multi-class classification. Experimental results on the CERT insider threat dataset show that our scheme achieves 97.2% accuracy and an F1 score of 0.72, significantly outperforming existing schemes.",2161-4407,979-8-3315-1042-8,10.1109/IJCNN64981.2025.11229300,National Key Research and Development Program of China; National Natural Science Foundation of China; ,https://ieeexplore.ieee.org/stamp/stamp.jsp?arnumber=11229300,Self-Contrastive Learning;Anomaly Detection;Insider Threat Detection;Knowledge-Enhanced,Accuracy;Filters;Attention mechanisms;Semantics;Organizations;Threat assessment;Encoding;Robustness;Real-time systems;Anomaly detection,,,,27,IEEE,14-Nov-25,30 June-5 July 2025,30 June-5 July 2025,IEEE,IEEE Conferences
A Lower-Cost Insider Threat Detection Framework Based on User Cluster and Behavior Feature Analysis,M. He; W. Li; Z. Xu,"Anhui Province Key Laboratory of Digital Security, University of Science and Technology of China Hefei, Anhui, China; Anhui Province Key Laboratory of Digital Security, University of Science and Technology of China Hefei, Anhui, China; Anhui Province Key Laboratory of Digital Security, University of Science and Technology of China Hefei, Anhui, China","2024 IEEE International Conference on Security, Privacy, Anonymity in Computation and Communication and Storage (SpaCCS)",25-Apr-25,2024,,,19,26,"Insider threat are actions by insiders that violate an organization's security policies, and have become a serious challenge to organizational security in digital and cloud-based environments nowadays. As a result, insider threat detection has become one of the key strategies to secure organizational information assets. However, existing methods are costly to maintain a model for each user, and in order to maintain a high detection accuracy, these methods are overly sensitive to user behavior, which leads to a high false positive and negatively affects the detection of user behavior. In this paper, we propose a lower-cost insider threat detection framework (LITD) based on user cluster and user behavior analysis. LITD clusters user classes according to user behavioral features, and trains deep learning models for each user class instead of a single user, thereby reducing the detection cost. In addition, we design a log content detection model to detect threatening information in specific log content. A risk detection and assessment model is built to use a risk list for final determination, and it significantly reduces the false positive while ensuring detection accuracy based on the combined assessment of multiple risks. A series of experiments are conducted using the publicly available CERT dataset, the results show that LITD outperforms state-of-the-art methods in the four metrics of Accuracy, Precision, Recall, and False Positive Rate (FPR), with the FPR metric being considerably lower.",,979-8-3315-2107-3,10.1109/SpaCCS63173.2024.00010,,https://ieeexplore.ieee.org/stamp/stamp.jsp?arnumber=10973556,Insider Threat Detection;User Cluster;User Behavior Feature Analysis;Deep Learning,Measurement;Deep learning;Analytical models;Privacy;Costs;Accuracy;Large language models;Feature extraction;Threat assessment;Security,,,,29,IEEE,25-Apr-25,30 Oct.-2 Nov. 2024,30 Oct.-2 Nov. 2024,IEEE,IEEE Conferences
Supervised Learning for Insider Threat Detection Using Stream Mining,P. Parveen; Z. R. Weger; B. Thuraisingham; K. Hamlen; L. Khan,"Department of Computer Science, University of Texas, Dallas, USA; Department of Computer Science, University of Texas, Dallas, USA; Department of Computer Science, University of Texas, Dallas, USA; Department of Computer Science, University of Texas, Dallas, USA; Department of Computer Science, University of Texas, Dallas, USA",2011 IEEE 23rd International Conference on Tools with Artificial Intelligence,15-Dec-11,2011,,,1032,1039,Insider threat detection requires the identification of rare anomalies in contexts where evolving behaviors tend to mask such anomalies. This paper proposes and tests an ensemble-based stream mining algorithm based on supervised learning that addresses this challenge by maintaining an evolving collection of multiple models to classify dynamic data streams of unbounded length. The result is a classifier that exhibits substantially increased classification accuracy for real insider threat streams relative to traditional supervised learning (traditional SVM and one-class SVM) and other single-model approaches.,2375-0197,978-0-7695-4596-7,10.1109/ICTAI.2011.176,,https://ieeexplore.ieee.org/stamp/stamp.jsp?arnumber=6103467,anomaly detection;support vector machine;insider threat;ensemble,Support vector machines;Data models;Training data;Supervised learning;Training;Feature extraction;Predictive models,,30,,44,IEEE,15-Dec-11,7-9 Nov. 2011,7-9 Nov. 2011,IEEE,IEEE Conferences
DMFI: A Dual-Modality Log Analysis Framework for Insider Threat Detection with LoRA-Tuned Language Models,K. Kong; D. Liu; X. Jin; G. Geng; Z. Li; J. Weng,"College of Cyber Security, Jinan University, Guangzhou, China; College of Cyber Security, Jinan University, Guangzhou, China; School of Advanced Technology, Xi'an Jiaotong-Liverpool University, Suzhou, China; College of Cyber Security, Jinan University, Guangzhou, China; College of Cyber Security, Jinan University, Guangzhou, China; College of Cyber Security, Jinan University, Guangzhou, China",2025 IEEE International Conference on Data Mining (ICDM),25-Feb-26,2025,,,387,396,"Insider threat detection (ITD) poses a persistent and high-impact challenge in cybersecurity due to the subtle, long-term, and context-dependent nature of malicious insider behaviors. Traditional models often struggle to capture semantic intent and complex behavior dynamics, while existing LLMbased solutions face limitations in prompt adaptability and modality coverage. To bridge this gap, we propose DMFI, a dual-modality framework that integrates semantic inference with behavior-aware fine-tuning. DMFI converts raw logs into two structured views: (1) a semantic view that processes content-rich artifacts (e.g., emails, https) using instruction-formatted prompts; and (2) a behavioral abstraction, constructed via a 4 W -guided (When-Where-What-Which) transformation to encode contextual action sequences. Two LoRA-enhanced LLMs are fine-tuned independently, and their outputs are fused via a lightweight MLP-based decision module. We further introduce DMFI-B, a discriminative adaptation strategy that separates normal and abnormal behavior representations, improving robustness under severe class imbalance. Experiments on CERT r4.2 and r5.2 datasets demonstrate that DMFI outperforms state-of-the-art methods in detection accuracy. Our approach combines the semantic reasoning power of LLMs with structured behavior modeling, offering a scalable and effective solution for real-world insider threat detection.",2374-8486,979-8-3315-9599-9,10.1109/ICDM65498.2025.00046,,https://ieeexplore.ieee.org/stamp/stamp.jsp?arnumber=11391790,Insider Threat Detection;Large Language Models;Dual-Modality Learning;Semantic Analysis;LoRA Finetuning,Adaptation models;Large language models;Semantics;Threat assessment;Robustness;Data models;Cognition;Data mining;Computer security;Faces,,,,32,IEEE,25-Feb-26,12-15 Nov. 2025,12-15 Nov. 2025,IEEE,IEEE Conferences
Scenario-Based Insider Threat Detection From Cyber Activities,P. Chattopadhyay; L. Wang; Y. -P. Tan,"Department of Computer Science and Engineering, IIT (BHU) Varanasi, Varanasi, India; School of Electrical and Electronic Engineering, Nanyang Technological University, Singapore; School of Electrical and Electronic Engineering, Nanyang Technological University, Singapore",IEEE Transactions on Computational Social Systems,12-Sep-18,2018,5,3,660,675,"An insider threat scenario refers to the outcome of a set of malicious activities caused by intentional or unintentional misuse of the organization's systems, networks, data, and resources. Prevention of insider threat is difficult, since trusted partners of the organization are involved in it, who have authorized access to these confidential/sensitive resources. The state-of-the-art research on insider threat detection mostly focuses on developing unsupervised behavioral anomaly detection techniques with the objective of finding out anomalousness or abnormal changes in user behavior over time. However, an anomalous activity is not necessarily malicious that can lead to an insider threat scenario. As an improvement to the existing approaches, we propose a technique for insider threat detection from time-series classification of user activities. Initially, a set of single-day features is computed from the user activity logs. A time-series feature vector is next constructed from the statistics of each single-day feature over a period of time. The label of each time-series feature vector (whether malicious or nonmalicious) is extracted from the ground truth. To classify the imbalanced ground-truth insider threat data consisting of only a small number of malicious instances, we employ a cost-sensitive data adjustment technique that undersamples the nonmalicious class instances randomly. As a classifier, we employ a two-layered deep autoencoder neural network and compare its performance with other popularly used classifiers: random forest and multilayer perceptron. Encouraging results are obtained by evaluating our approach using the CMU Insider Threat Data, which is the only publicly available insider threat data set consisting of about 14-GB web-browsing logs, along with logon, device connection, file transfer, and e-mail log files. We observe that both deep autoencoder and random forest classifiers classify the dataadjusted time-series feature set with high precision, recall, and f-score. Although multilayer perceptron has a high recall, it suffers from a lower precision and f-score compared to the other two classifiers.",2329-924X,,10.1109/TCSS.2018.2857473,,https://ieeexplore.ieee.org/stamp/stamp.jsp?arnumber=8444978,Cost-sensitive learning;imbalanced data;insider threat;time-series classification,Organizations;Anomaly detection;Electronic mail;Feature extraction;Forestry;Web pages;Thumb,,98,,67,IEEE,23-Aug-18,Sept. 2018,,IEEE,IEEE Journals
Robust Anomaly-Based Insider Threat Detection Using Graph Neural Network,J. Xiao; L. Yang; F. Zhong; X. Wang; H. Chen; D. Li,"School of Systems Science and Engineering, Sun Yat-sen University, Guangzhou, China; National Key Laboratory of Science and Technology on Information System Security, Institute of System Engineering, Chinese Academy of Military Science, Beijing, China; School of Systems Science and Engineering, Sun Yat-sen University, Guangzhou, China; School of Systems Science and Engineering, Sun Yat-sen University, Guangzhou, China; School of Systems Science and Engineering, Sun Yat-sen University, Guangzhou, China; Command and Control Engineering College, Army Engineering University of PLA, Nanjing, China",IEEE Transactions on Network and Service Management,9-Oct-23,2023,20,3,3717,3733,"Misuse or malicious access to critical assets of information systems by insiders usually causes significant loss to organizations. The issue of insider threat detection for information systems has received many researchers’ attention in both security and data mining fields, and a lot of related research results were presented. However, there are still many challenges in capturing the behavior difference between malicious insiders and normal users accurately, such as lack of labeled insider threats, the subtle and adaptive nature of insider threats, complexity, heterogeneity, sparsity of the underlying data, etc. To detect insider threats with large and complex audit data, a Multi-Edge Weight Relational Graph Neural Network method (MEWRGNN) for robust anomaly detection is proposed in this paper. Unlike most existing approaches, the MEWRGNN adopts several graph neural networks to capture the contextual relationship of user behaviors over a period of time, which is a critical factor for achieving accurate anomaly identification. The MEWRGNN achieves a certain degree of interpretability through ranking the contribution of different edge-representation features. Evaluation experimental results demonstrate that the MEWRGNN can learn a model from limited sample data sets, and achieve quick and accurate insider threat detection performance. In addition, other feature ranking results allow providing security analysts with understandable insights for investigating the detected insider threats.",1932-4537,,10.1109/TNSM.2022.3222635,"National Natural Science Foundation of China(grant numbers:62102466); Fundamental Research Funds for the Central Universities, Sun Yat-sen University(grant numbers:22qntd1602); ",https://ieeexplore.ieee.org/stamp/stamp.jsp?arnumber=9953125,Anomaly detection;insider threat;graph neural network,Feature extraction;Security;Psychology;Information systems;Graph neural networks;Deep learning;Data mining,,33,,51,IEEE,16-Nov-22,Sept. 2023,,IEEE,IEEE Journals
MITD: A Multi-Dimensional Insider Threat Detection Framework Based On Deep Learning,L. Peng; J. Feng; Y. Huang; H. Zhou; H. Qin; F. Qiu,"School of Computer Science and Technology, Southwest University of Science and Technology, Mianyang, China; School of Computer Science and Technology, Southwest University of Science and Technology, Mianyang, China; School of Computer Science and Technology, Southwest University of Science and Technology, Mianyang, China; School of Computer Science and Technology, Southwest University of Science and Technology, Mianyang, China; School of Computer Science and Technology, Southwest University of Science and Technology, Mianyang, China; School of Mechanical Engineering and Vehicle Engineering, Beijing Institute of Technology, Beijing, China","2024 17th International Congress on Image and Signal Processing, BioMedical Engineering and Informatics (CISP-BMEI)",7-Mar-25,2024,,,1,8,"In this paper, we propose a multi-dimensional insider threat detection framework (MITD), which aims to improve the accuracy of detection by comprehensively analyzing user behavior patterns. We combine statistical features and behavioral sequences and use sequence pattern recognition, graph structure information mining, and adaptive feature extraction methods. It can reveal user behavior from multiple dimensions. Then, we intelligently fuse the extracted multi-dimensional features to generate a comprehensive feature representation. It is further fused with statistical features through two strategies: concat and bitwise addition. Experimental results based on the CERT r4.2 dataset show that the MITD framework significantly improves in terms of accuracy, precision, recall, and F1 score, reaching 93.2% accuracy and 93.5% recall. The results show that the MITD framework effectively improves the performance of insider threat detection and has great potential in practical applications.",,979-8-3315-0739-8,10.1109/CISP-BMEI64163.2024.10906151,,https://ieeexplore.ieee.org/stamp/stamp.jsp?arnumber=10906151,insider threat;threat detection;feature extraction;feature fusion,Measurement;Adaptation models;Accuracy;Fuses;Neural networks;Signal processing;Feature extraction;Threat assessment;Pattern recognition;Informatics,,,,27,IEEE,7-Mar-25,26-28 Oct. 2024,26-28 Oct. 2024,IEEE,IEEE Conferences
