Visualizing the insider threat: challenges and tools for identifying malicious user activity,P. A. Legg,"Department of Computer Science and Creative Technologies, University of the West of England, Bristol, UK",2015 IEEE Symposium on Visualization for Cyber Security (VizSec),2-Nov-15,2015,,,1,7,"One of the greatest challenges for managing organisational cyber security is the threat that comes from those who operate within the organisation. With entitled access and knowledge of organisational processes, insiders who choose to attack have the potential to cause serious impact, such as financial loss, reputational damage, and in severe cases, could even threaten the existence of the organisation. Security analysts therefore require sophisticated tools that allow them to explore and identify user activity that could be indicative of an imminent threat to the organisation. In this work, we discuss the challenges associated with identifying insider threat activity, along with the tools that can help to combat this problem. We present a visual analytics approach that incorporates multiple views, including a user selection tool that indicates anomalous behaviour, an interactive Principal Component Analysis (iPCA) tool that aids the analyst to assess the reasoning behind the anomaly detection results, and an activity plot that visualizes user and role activity over time. We demonstrate our approach using the Carnegie Mellon University CERT Insider Threat Dataset to show how the visual analytics workflow supports the Information-Seeking mantra.",,978-1-4673-7599-3,10.1109/VIZSEC.2015.7312772,,https://ieeexplore.ieee.org/stamp/stamp.jsp?arnumber=7312772,Insider threat;behavioural analysis;model visualization,Visual analytics;Principal component analysis;Feature extraction;Electronic mail;Data visualization;Security,,35,,26,IEEE,2-Nov-15,25-25 Oct. 2015,25-25 Oct. 2015,IEEE,IEEE Conferences
Multi-source data fusion for insider threat detection using residual networks,D. Ge; S. Zhong; K. Chen,"College of Computer and Data Science, Fuzhou University, Fuzhou, China; College of Computer and Data Science, Fuzhou University, Fuzhou, China; College of Computer and Data Science, Fuzhou University, Fuzhou, China","2022 3rd International Conference on Electronics, Communications and Information Technology (CECIT)",5-Apr-23,2022,,,359,366,"With the increased diversity of audit data sources and data heterogeneity within organizations, leveraging various data sources and fusing them is critical to improving insider threat detection. The data context between different sources is a part that is often overlooked by existing anomaly detection techniques. In this paper, we propose an insider threat detection method using residual convolutional neural networks for multisource data fusion to discover undetectable combinations of potential threats. The method first transforms tabular data into neighborhood-correlated feature maps, which allows for the contextual information fusion of the same layer by convolutional structure. Skip connections are then added between convolutional layers of different depths for multi-level feature fusion, which allows rich features at lower level to directly share weight information with highly aggregated features at higher levels. We simulated idealistic and realistic conditions for the experiments, and the results on the CERT dataset demonstrate the effectiveness of the proposed method. The insider detection rate is increased by 6% to 8% compared to 1D convolutional neural network models and by 8% to 14% compared to tree-based (Random Forest, XGBoost) models.",,979-8-3503-3197-4,10.1109/CECIT58139.2022.00069,National Natural Science Foundation of China; Natural Science Foundation of Fujian Province; ,https://ieeexplore.ieee.org/stamp/stamp.jsp?arnumber=10086398,component;insider threat;multi-source data fusion;residual networks;tabular data;skip connection,Fuses;Soft sensors;Data integration;Transforms;Organizations;Feature extraction;Data models,,5,,33,IEEE,5-Apr-23,23-25 Dec. 2022,23-25 Dec. 2022,IEEE,IEEE Conferences
Unsupervised Insider Threat Detection Using Multi-Head Self-Attention Mechanisms,S. Bertrand; P. Germain; N. Tawbi,"dept. of Computer Science & Software Engineering, Laval University, Québec, Canada; dept. of Computer Science & Software Engineering, Laval University, Québec, Canada; dept. of Computer Science & Software Engineering, Laval University, Québec, Canada",2024 4th Intelligent Cybersecurity Conference (ICSC),25-Feb-25,2024,,,228,236,"We propose an unsupervised insider threat detection system that learns normal user behaviors through audit data using neural networks equipped with multi-head self-attention mechanisms. The attention mechanisms learn precise normal user behaviors using large event windows. The key idea is to consider a sequence abnormal when it exhibits some events that are not likely to happen given the preceding events sequence. In addition, our method provides insights into detected threats through an event-based scoring system to facilitate threat understanding by security experts. Furthermore, the proposed solution does not require intensive audit logs pre-processing, such as manual domain knowledge-rich features extraction and data balancing. Thus, the proposed approach is easy to implement and use across organizations regardless of their expertise level. The proposed solution also provides the ability to detect threats in real-time. On the benchmark dataset CERT version 4.2, our solution, combined with hyperparameter search by Bayesian optimization, outperforms the previous state-of-the-art approaches with an area under the ROC curve of 97.23%, a recall of 91.51%, an accuracy of 93.13% and a false positive rate of 6.8%.",,979-8-3503-5477-5,10.1109/ICSC63108.2024.10895186,,https://ieeexplore.ieee.org/stamp/stamp.jsp?arnumber=10895186,Insider Threat Detection;Deep Neural Networks;Attention Mechanisms;Unsupervised Learning;Audit Data,Neural networks;Manuals;Feature extraction;Vectors;Threat assessment;Data models;Real-time systems;Bayes methods;Optimization;Tuning,,,,34,IEEE,25-Feb-25,17-20 Sept. 2024,17-20 Sept. 2024,IEEE,IEEE Conferences
GMFITD: Graph Meta-Learning for Effective Few-Shot Insider Threat Detection,X. Li; L. Li; X. Li; B. Cai; J. Jia; Y. Gao; S. Yu,"Key Laboratory of Trustworthy Distributed Computing and Service, Ministry of Education, Beijing University of Posts and Telecommunications, Beijing, China; Key Laboratory of Trustworthy Distributed Computing and Service, Ministry of Education, Beijing University of Posts and Telecommunications, Beijing, China; Key Laboratory of Trustworthy Distributed Computing and Service, Ministry of Education, Beijing University of Posts and Telecommunications, Beijing, China; Key Laboratory of Trustworthy Distributed Computing and Service, Ministry of Education, Beijing University of Posts and Telecommunications, Beijing, China; Key Laboratory of Trustworthy Distributed Computing and Service, Ministry of Education, Beijing University of Posts and Telecommunications, Beijing, China; Key Laboratory of Trustworthy Distributed Computing and Service, Ministry of Education, Beijing University of Posts and Telecommunications, Beijing, China; School of Computer Science, University of Technology Sydney, Ultimo, NSW, Australia",IEEE Transactions on Information Forensics and Security,29-Jul-24,2024,19,,7161,7175,"Insider threats represent a significant challenge in both corporate and governmental sectors. Most existing supervised learning based detection methods that rely on transforming user behavior into sequential data do not fully utilize structural information and require extensive labeled data. This reliance poses a challenge due to the scarcity of labeled data in real-world scenarios, leading to a few-shot learning situation. To address these limitations, we propose a novel Graph modularized-based Meta-learning Framework for Insider Threat Detection, named GMFITD. Specifically, GMFITD utilizes a structural reconstruction mechanism that combines a graph-based autoencoder with an attention mechanism to explore structural information and infer potential relationships between users. Additionally, we employ a graph prototype construction method coupling episodic meta-learning principle (MAML) to compute representative embeddings for few-shot learning scenarios. By leveraging MAML, the proposed method can capture prior knowledge of insider threat classification by training on similar few-shot learning tasks with few labeled samples. We further enhance the resilience of GMFITD to adversarial attacks through an edge importance estimation mechanism, which assigns higher weights to relevant edges. Extensive experiments demonstrate that our proposed GMFITD outperforms state-of-the-art methods in insider threat detection, achieving higher accuracy with fewer labeled samples and resisting adversarial attacks.",1556-6021,,10.1109/TIFS.2024.3430106,"National Key Research and Development Program of China(grant numbers:2023YFB3106404,2023YFB3107601); National Natural Science Foundation of China(grant numbers:62202066,62002011,62302056); ",https://ieeexplore.ieee.org/stamp/stamp.jsp?arnumber=10601241,Insider threat;graph neural network;meta-learning,Threat assessment;Metalearning;Few shot learning;Image edge detection;Task analysis;Feature extraction;Data models,,8,,57,IEEE,17-Jul-24,2024,,IEEE,IEEE Journals
Anomaly Detection in Social Networks using Improved Local Outlier Factor,R. V. S. S. Bharattej R; M. Mhsnhasan; S. M; P. M V; K. Ghamya,"Department of Computer Science, Saint Leo University, FL, USA; Department of Computers Techniques Engineering, College of Technical Engineering, The Islamic University of Al Diwaniyah, Al Diwaniyah, Iraq; Department of Artificial Intelligence and Data Science, Nitte Meenakshi Institute of Technology, Bengaluru, India; Department of Computer Science and Engineering (Cyber Security), Dhanalakshmi Srinivasan College of Engineering and Technology, Mamallapuram, India; Department of Computer Science and Engineering (AI&ML), Mohan Babu University, Tirupati, India",2025 International Conference on Intelligent Systems and Computational Networks (ICISCN),27-Mar-25,2025,,,1,5,"In the present era, Anomaly Detection (AD) aims to identify malicious activities in social networks. Even though previous researchers suggest effective methods for AD still there are limitations such as a lack of labeled data and struggled to handle high dimensional data. In this research, Improved Local Outlier Factor (ILOF) is proposed to detect anomalies and effectively handles the high dimensional data by using distance metric to calculate local density. Primarily, the data is collected from CERT insider threat and then preprocessed with truncation to remove extreme values for effective feature extraction. After that, the Principal Component Analysis (PCA) is incorporated to extract most informative features such as principal components to identify anomalies as data points. Finally, the extracted features are fed into proposed ILOF uses density-based approach to calculate the local density effectively for detecting anomalies in social networks. From the results, proposed ILOF model attained better outcomes compared to existing Bidirectional Long Short-Term Memory (BiLSTM) in terms of accuracy, precision, recall and F1-score as 98.50%, 97.08%, 98.25% and 97.66% respectively.",,979-8-3315-2924-6,10.1109/ICISCN64258.2025.10934629,,https://ieeexplore.ieee.org/stamp/stamp.jsp?arnumber=10934629,anomaly detection;improved local outlier factor;principal component analysis;social networks;truncation,Measurement;Accuracy;Social networking (online);High dimensional data;Transfer learning;Feature extraction;Real-time systems;Intelligent systems;Anomaly detection;Principal component analysis,,2,,22,IEEE,27-Mar-25,24-25 Jan. 2025,24-25 Jan. 2025,IEEE,IEEE Conferences
Improving Insider Threat Detection with User and Role-Based Behavior,A. Singh; M. Rakhra; D. Singh; B. Kaur; H. Kaur,"Department of Computer Science & Engineering, Lovely Professional University, Jalandhar, Phagwara, India; Department of Computer Science & Engineering, Lovely Professional University, Jalandhar, Phagwara, India; Department of Computer Science & Engineering, Lovely Professional University, Jalandhar, Phagwara, India; Department of Computer Science & Engineering, Lovely Professional University, Jalandhar, Phagwara, India; Department of Computer Science & Engineering, Lovely Professional University, Jalandhar, Phagwara, India","2024 11th International Conference on Reliability, Infocom Technologies and Optimization (Trends and Future Directions) (ICRITO)",14-May-24,2024,,,1,6,"Insider threats are a growing concern for organizations, and existing methods have fallen short in their ability to detect these threats effectively. One significant constraint of current techniques is their inability to discern between the conduct of malicious users and that of their counterparts in identical job roles. But these methods did not use features that show how different a user's behavior is from that of their peers in the same job role. This study aims to detect insider threats by analyzing the user and roles that may involve in malicious activity. Malicious users can be identified by extracting different features that describe their activities and how they differ from those of their peers. The Isolation Forest Algorithm is an unsupervised method that compares each user's variance across many attributes with those of their peers in order to identify abnormalities. The performance of the proposed approach is thoroughly evaluated through a series of experiments conducted. The results of the comparison between the proposed method and a current state-of-the-art technique confirm's that the proposed detection method is more reliable.",2769-2884,979-8-3503-5035-7,10.1109/ICRITO61523.2024.10522467,,https://ieeexplore.ieee.org/stamp/stamp.jsp?arnumber=10522467,Insider Threat;malicious users;Job roles;Isolation Forest algorithm,Measurement;Heuristic algorithms;Forestry;Organizations;Feature extraction;Prediction algorithms;Threat assessment,,12,,25,IEEE,14-May-24,14-15 March 2024,14-15 March 2024,IEEE,IEEE Conferences
Empirical Detection Techniques of Insider Threat Incidents,R. A. Alsowail; T. Al-Shehari,"Deanship of Common First Year, King Saud University, Riyadh, Saudi Arabia; Deanship of Common First Year, King Saud University, Riyadh, Saudi Arabia",IEEE Access,6-May-20,2020,8,,78385,78402,"Vital organizations have faced increasing challenges of how to defend against insider threats that may cause a severe damage to their assets. The nature of insider threats is more challenging than external threats, as insiders have a privileged access to sensitive assets of an organization. In fact, there are several studies that reviewed the insider threat detection approaches from taxonomical and theoretical perspectives. However, the protection against insider threat incidents requires empirical defense solutions. Hence, our study uniquely focuses on empirical detection approaches that are validated with empirical results. We propose a 10-question model that highlights different prospective of empirical detection approaches. Significant factors are also proposed to reveal the extent to which the detection approaches are effective against insider threat incidents (e.g., feature domains, protection coverage, classification techniques, simulated scenarios, performance and accuracy metrics, etc.). The objective of this paper is to enhance researchers' efforts in the domain of insider attack by systemizing the detection techniques in comparable manner. It also highlights the challenges and gaps for further research to institute more effective solutions that can predict, detect, and prevent emerging attack incidents. Some recommendations for future research directions are also presented.",2169-3536,,10.1109/ACCESS.2020.2989739,Deanship of Scientific Research at King Saud University(grant numbers:RG-1441-401); ,https://ieeexplore.ieee.org/stamp/stamp.jsp?arnumber=9076665,Insider threat;rigorous literature review;10-question model;insider attack detection;information security,Organizations;Market research;Taxonomy;Feature extraction;Bibliographies;Security;Measurement,,31,,78,CCBY,23-Apr-20,2020,,IEEE,IEEE Journals
A Graph Convolution Neural Network Based Method for Insider Threat Detection,K. Fei; J. Zhou; L. Su; W. Wang; Y. Chen; F. Zhang,"School of Cyber Security, University of Chinese Academy of Sciences, Beijing, China; Institute of Information Engineering, Chinese Academy of Sciences, Beijing, China; Institute of Information Engineering, Chinese Academy of Sciences, Beijing, China; Institute of Information Engineering, Chinese Academy of Sciences, Beijing, China; Department of Computer Science, Texas Tech University, Lubbock, USA; Information Technology Center China Mobile, Beijing, China","2022 IEEE Intl Conf on Parallel & Distributed Processing with Applications, Big Data & Cloud Computing, Sustainable Computing & Communications, Social Computing & Networking (ISPA/BDCloud/SocialCom/SustainCom)",23-Mar-23,2022,,,66,73,"In this research, we propose Log2Graph, a new insider threat detection method based on graph convolution neural network (GCN). This method first retrieves the corresponding logs and features from log files through feature extraction. Specifically, we use an auxiliary feature of anomaly index to describe relationship between entities, such as users and hosts, instead of establish complex connections between them. Second, these logs and features are augmented through a combination of oversampling and downsampling, to prepare for the next-stage supervised learning process. Third, we use three elaborated rules to construct the graph of each user by connecting the logs according to chronological and logical relationship. At last, the graph convolution neural network constructed is used to detect insider threats. Our validation and evaluation results confirm that Log2Graph can greatly improve the performance of detecting insider threats compared against baseline and existing methods.",,978-1-6654-6497-0,10.1109/ISPA-BDCloud-SocialCom-SustainCom57177.2022.00016,"National Science Foundation(grant numbers:OAC-1835892,CNS-1817094,CNS-1939140); ",https://ieeexplore.ieee.org/stamp/stamp.jsp?arnumber=10070663,Insider threat detection;cluster security;graph construction;graph convolution neural network,Knowledge engineering;Convolution;Neural networks;Supervised learning;Feature extraction;Time measurement;Data models,,15,,37,IEEE,23-Mar-23,17-19 Dec. 2022,17-19 Dec. 2022,IEEE,IEEE Conferences
ACE – An Anomaly Contribution Explainer for Cyber-Security Applications,X. Zhang; M. Marwah; I. -t. Lee; M. Arlitt; D. Goldwasser,"Department of CS, Purdue University, USA; Micro Focus, USA; Department of CS, Purdue University, USA; Micro Focus, Canada; Department of CS, Purdue University, USA",2019 IEEE International Conference on Big Data (Big Data),24-Feb-20,2019,,,1991,2000,"In this paper we introduce Anomaly Contribution Explainer or ACE, a tool to explain security anomaly detection models in terms of the model features through a regression framework, and its variant, ACE-KL, which highlights the important anomaly contributors. ACE and ACE-KL provide insights in diagnosing which attributes significantly contribute to an anomaly by building a specialized linear model to locally approximate the anomaly score that a black-box model generates. We conducted experiments with these anomaly detection models to detect security anomalies on both synthetic data and real data. In particular, we evaluate performance on three public data sets: CERT insider threat, netflow logs, and Android malware. The experimental results are encouraging: our methods consistently identify the correct contributing feature in the synthetic data where ground truth is available; similarly, for real data sets, our methods point a security analyst in the direction of the underlying causes of an anomaly, including in one case leading to the discovery of previously overlooked network scanning activity. We have made our source code publicly available.",,978-1-7281-0858-2,10.1109/BigData47090.2019.9005989,,https://ieeexplore.ieee.org/stamp/stamp.jsp?arnumber=9005989,anomaly detection;model explanation;model interpretability;cyber-security,Anomaly detection;Predictive models;Biological system modeling;Feature extraction;Machine learning;Computer security,,9,,42,IEEE,24-Feb-20,9-12 Dec. 2019,9-12 Dec. 2019,IEEE,IEEE Conferences
Intranet User-Level Security Traffic Management with Deep Reinforcement Learning,Q. Jin; L. Wang,"School of Cyber Security, University of Chinese Academy of Sciences, Beijing, China; Institute of Information Engineering, Chinese Academy of Sciences, Beijing, China",2019 International Joint Conference on Neural Networks (IJCNN),30-Sep-19,2019,,,1,8,"Insider threats gradually exert great influence in cy-bersecurity, causing a significant loss to organizations or companies. However, whatever the form of the threat is, insiders have to conduct the unauthorized activities through the communication traffic, such as controlling the victim systems and unauthorizedly requesting the resources. Moreover, as one of the most fundamental intranet resources, bandwidth is frequently targeted by insider attackers for sabotage to traffic communication and service delivery of the network. In this paper, we present a user-level full-lifecycle security management scheme for intranet traffic from anomaly detection to mitigation execution in an online manner. This scheme dynamically monitors abnormal users that deviate from normal behavior patterns through bidirectional Gated Recurrent Unit (bi-GRU) based online unsupervised log parser, then adaptively adjusts the traffic scheduling policy according to the adequate consideration of network security, network performance and user requirements by using deep Reinforcement Learning (RL) method for online decision-making. Extensive experimental evaluations show that our scheme can stably maintain the high performance of traffic scheduling and effectively mitigate multifarious traffic threats. Our work is a valuable step towards designing self-adaptive intranets that learn to enhance security management by themselves with high scalability and deployability.",2161-4407,978-1-7281-1985-4,10.1109/IJCNN.2019.8852447,,https://ieeexplore.ieee.org/stamp/stamp.jsp?arnumber=8852447,Insider threat;traffic management;user trust;reinforcement learning,Security;Feature extraction;Reinforcement learning;Anomaly detection;Real-time systems;Organizations;Dynamic scheduling,,6,1,27,IEEE,30-Sep-19,14-19 July 2019,14-19 July 2019,IEEE,IEEE Conferences
Class Balancing for Fraud Detection in Point Of Sale Systems,C. Hines; A. Youssef,"Department of Computer Science, George Washington University, Washington, DC, USA; Department of Computer Science, George Washington University, Washington, DC, USA",2019 IEEE International Conference on Big Data (Big Data),24-Feb-20,2019,,,4730,4739,"Restaurant servers are an example of an insider threat to the security of restaurant financial data. This paper applies machine learning to detect the digital representation of malevolent behavior of restaurant employees. The results of this research could be used to notify restaurant owners in real time when fraud is being committed. This paper applies machine learning (ML) techniques including neural networks, support vector machines, Random Forest, and Adaboost, to detecting insider fraud in restaurant point-of-sales data. By applying undersampling and oversampling class balancing techniques we show that ML techniques can improve fraud detection performance. In particular, detection with a Random Forest model using cross validation can be increased 55% by oversampling the minority class to the same size as the majority class. And results with a Neural Net model trained to detect fraud on the first year the restaurant opened, and tested on data from the following year can be improved by 50% by decreasing the majority class to be the same size as the minority class.",,978-1-7281-0858-2,10.1109/BigData47090.2019.9006040,,https://ieeexplore.ieee.org/stamp/stamp.jsp?arnumber=9006040,machine learning;classification;class balancing;fraud detection;point-of-sale data,Big Data;Conferences,,2,,11,IEEE,24-Feb-20,9-12 Dec. 2019,9-12 Dec. 2019,IEEE,IEEE Conferences
